{"ts":"2026-05-26T00:00:00Z","run":"local-2026-05-26-1","change":{"LEARNING_RATE":"4.25e-4f"},"context":"resumed from existing checkpoint after ACCUM_STEPS=14","metrics":{"val_loss":2.644823,"train_loss":2.964848,"steps":2916,"ms_per_step":94.6,"ane_util_pct":6.6},"baseline_note":"previous local resumed run at ACCUM_STEPS=14 had val_loss 3.114565","delta_vs_previous":-0.469742,"verdict":"keep"}
{"ts":"2026-05-26T00:00:00Z","run":"local-2026-05-26-2","change":{"LEARNING_RATE":"4.0e-4f"},"context":"resumed from existing checkpoint after ACCUM_STEPS=14","metrics":{"val_loss":2.461927,"train_loss":2.252364,"steps":2941,"ms_per_step":93.7,"ane_util_pct":6.7},"baseline_note":"previous local run at 4.25e-4 had val_loss 2.644823","delta_vs_previous":-0.182896,"verdict":"keep"}
{"ts":"2026-05-26T00:00:00Z","run":"local-2026-05-26-3","change":{"LEARNING_RATE":"3.8e-4f"},"context":"resumed from existing checkpoint after ACCUM_STEPS=14","metrics":{"val_loss":2.437545,"train_loss":1.781786,"steps":2947,"ms_per_step":93.6,"ane_util_pct":6.7},"baseline_note":"previous local run at 4.0e-4 had val_loss 2.461927","delta_vs_previous":-0.024382,"verdict":"keep"}
{"ts":"2026-05-26T00:00:00Z","run":"local-2026-05-26-4","change":{"LEARNING_RATE":"3.7e-4f"},"context":"resumed from existing checkpoint after ACCUM_STEPS=14","metrics":{"val_loss":2.514317,"train_loss":2.242823,"steps":2946,"ms_per_step":93.6,"ane_util_pct":6.7},"baseline_note":"previous local run at 3.8e-4 had val_loss 2.437545","delta_vs_previous":0.076772,"verdict":"discard"}
{"ts":"2026-05-26T00:00:00Z","run":"local-2026-05-26-5","change":{"LR_MIN_FRAC":"0.05f"},"context":"resumed from existing checkpoint after ACCUM_STEPS=14 and LEARNING_RATE=3.8e-4f","metrics":{"val_loss":2.675144,"train_loss":1.440777,"steps":2943,"ms_per_step":93.7,"ane_util_pct":6.7},"baseline_note":"previous local run at 3.8e-4 had val_loss 2.437545","delta_vs_previous":0.237599,"verdict":"discard"}
{"ts":"2026-05-26T00:00:00Z","run":"local-2026-05-26-6","change":{"LEARNING_RATE":"3.9e-4f"},"context":"resumed from existing checkpoint after ACCUM_STEPS=14","metrics":{"val_loss":2.875534,"train_loss":2.285940,"steps":2945,"ms_per_step":93.6,"ane_util_pct":6.7},"baseline_note":"previous local run at 3.8e-4 had val_loss 2.437545","delta_vs_previous":0.437989,"verdict":"discard"}
{"ts":"2026-05-26T00:00:00Z","run":"local-2026-05-26-7","change":{"WEIGHT_DECAY":"0.09f"},"context":"resumed from existing checkpoint after ACCUM_STEPS=14","metrics":{"val_loss":3.087767,"train_loss":2.460310,"steps":2945,"ms_per_step":93.6,"ane_util_pct":6.7},"baseline_note":"previous local run at 3.9e-4 had val_loss 2.875534","delta_vs_previous":-0.212233,"verdict":"discard"}
{"ts":"2026-05-26T00:00:00Z","run":"local-2026-05-26-8","change":{"LR_MIN_FRAC":"0.15f"},"context":"resumed from existing checkpoint after ACCUM_STEPS=14 with LEARNING_RATE=3.8e-4f and WEIGHT_DECAY=0.10f","metrics":{"val_loss":3.353078,"train_loss":2.262658,"steps":2942,"ms_per_step":93.7,"ane_util_pct":6.7},"baseline_note":"previous local run at WEIGHT_DECAY 0.09 had val_loss 3.087767","delta_vs_previous":-0.265311,"verdict":"discard"}
{"ts":"2026-05-26T00:00:00Z","run":"local-2026-05-26-9","change":{"WEIGHT_DECAY":"0.105f"},"context":"resumed from existing checkpoint after ACCUM_STEPS=14 with LEARNING_RATE=3.8e-4f and LR_MIN_FRAC=0.10f","metrics":{"val_loss":3.475891,"train_loss":2.790182,"steps":2944,"ms_per_step":93.7,"ane_util_pct":6.7},"baseline_note":"previous local run at LR_MIN_FRAC 0.15 had val_loss 3.353078","delta_vs_previous":-0.122813,"verdict":"discard"}
{"ts":"2026-05-26T00:00:00Z","run":"local-2026-05-26-10","change":{"mode":"fresh_restart","LEARNING_RATE":"3.8e-4f","WEIGHT_DECAY":"0.10f","LR_MIN_FRAC":"0.10f","ACCUM_STEPS":14},"context":"deleted checkpoint and restarted from scratch to anchor the best-known config","metrics":{"val_loss":3.651091,"train_loss":3.271285,"steps":2945,"ms_per_step":93.7,"ane_util_pct":6.7},"baseline_note":"best known val_loss is 2.432","delta_vs_previous":-1.219091,"verdict":"discard"}
{"ts":"2026-05-26T00:00:00Z","run":"local-2026-05-26-10","change":{"mode":"fresh_restart","LEARNING_RATE":"3.8e-4f","WEIGHT_DECAY":"0.10f","LR_MIN_FRAC":"0.10f","ACCUM_STEPS":14},"context":"deleted checkpoint and restarted from scratch to anchor the best-known config","metrics":{"val_loss":3.651091,"train_loss":3.271285,"steps":2945,"ms_per_step":93.7,"ane_util_pct":6.7},"baseline_note":"best known val_loss is 2.432","delta_vs_previous":-1.219091,"verdict":"discard"}
{"ts":"2026-05-26T00:00:00Z","run":"local-2026-05-26-11","change":{"mode":"resume_no_change","LEARNING_RATE":"3.8e-4f","WEIGHT_DECAY":"0.10f","LR_MIN_FRAC":"0.10f","ACCUM_STEPS":14},"context":"continued from the fresh restart checkpoint with no config change","metrics":{"val_loss":3.147180,"train_loss":2.946599,"steps":2944,"ms_per_step":93.6,"ane_util_pct":6.7},"baseline_note":"fresh restart run had val_loss 3.651091","delta_vs_previous":0.503911,"verdict":"keep"}
{"ts":"2026-05-26T00:00:00Z","run":"local-2026-05-26-12","change":{"ACCUM_STEPS":"14 -> 7","mode":"resume_from_fresh_anchor"},"context":"resumed from the fresh best-config anchor checkpoint to test trajectory sensitivity","metrics":{"val_loss":2.664419,"train_loss":2.262500,"steps":2807,"ms_per_step":93.7,"ane_util_pct":6.7},"baseline_note":"fresh anchor continuation had val_loss 3.147180","delta_vs_previous":0.482761,"verdict":"keep"}
{"ts":"2026-05-26T00:00:00Z","run":"local-2026-05-26-13","change":{"ACCUM_STEPS":"7 -> 4"},"context":"resumed from the fresh anchor checkpoint with best-known LR/WD/LR_MIN unchanged","metrics":{"val_loss":2.455971,"train_loss":1.970962,"steps":2621,"ms_per_step":93.6,"ane_util_pct":6.7},"baseline_note":"previous local run at ACCUM_STEPS 7 had val_loss 2.664419","delta_vs_previous":-0.208448,"verdict":"keep"}
{"ts":"2026-05-26T00:00:00Z","run":"local-2026-05-26-14","change":{"ACCUM_STEPS":"4 -> 2"},"context":"resumed from the fresh anchor checkpoint with best-known LR/WD/LR_MIN unchanged","metrics":{"val_loss":2.320954,"train_loss":1.880684,"steps":2270,"ms_per_step":93.7,"ane_util_pct":6.7},"baseline_note":"previous local run at ACCUM_STEPS 4 had val_loss 2.455971","delta_vs_previous":-0.135017,"verdict":"keep"}
{"ts":"2026-08-20T00:00:00Z","run":"local-2026-08-20-1","change":{"ACCUM_STEPS":"2 -> 1"},"context":"resumed from the preserved 2026-05-26 best checkpoint; bounded single-variable accumulation probe","metrics":{"val_loss":2.401719,"train_loss":1.727844,"steps":1123,"ms_per_step":137.7,"wall_time_s":292.2,"ane_util_pct":4.5},"baseline_note":"best known val_loss is 2.320954 at ACCUM_STEPS=2","delta_vs_baseline":0.080765,"verdict":"discard"}
{"ts":"2026-08-20T00:00:00Z","run":"local-2026-08-20-2","change":{"LEARNING_RATE":"3.8e-4f -> 3.6e-4f"},"context":"resumed from the preserved 2026-05-26 best checkpoint with ACCUM_STEPS=2; bounded LR probe","metrics":{"val_loss":2.346754,"train_loss":1.512082,"steps":2137,"ms_per_step":98.4,"wall_time_s":291.5,"ane_util_pct":6.4},"baseline_note":"best known val_loss is 2.320954 at LEARNING_RATE=3.8e-4f","delta_vs_baseline":0.025800,"verdict":"discard"}
{"ts":"2026-08-20T00:00:00Z","run":"local-2026-08-20-3","change":{"LEARNING_RATE":"3.8e-4f -> 3.7e-4f"},"context":"resumed from the preserved 2026-05-26 best checkpoint with ACCUM_STEPS=2; bounded LR probe","metrics":{"val_loss":2.348575,"train_loss":1.563702,"steps":2174,"ms_per_step":97.0,"wall_time_s":291.5,"ane_util_pct":6.5},"baseline_note":"best known val_loss is 2.320954 at LEARNING_RATE=3.8e-4f","delta_vs_baseline":0.027621,"verdict":"discard"}
